{
 "schema": "forecast/1",
 "license": "CC BY-SA 4.0",
 "attribution": "Open-Meteo.com (CC BY 4.0)",
 "generated_at": "2026-10-24T12:04:00Z",
 "town": "pedrengo",
 "issued_at": "2026-10-24T12:00:00Z",
 "method": "mean60-v1",
 "models": [
  {
   "model": "ecmwf_ifs",
   "run_init": "2026-10-24T00:00:00Z"
  },
  {
   "model": "ecmwf_aifs025_single",
   "run_init": "2026-10-24T00:00:00Z"
  },
  {
   "model": "icon_d2",
   "run_init": "2026-10-24T09:00:00Z"
  },
  {
   "model": "icon_eu",
   "run_init": "2026-10-24T06:00:00Z"
  },
  {
   "model": "italia_meteo_arpae_icon_2i",
   "run_init": "2026-10-24T00:00:00Z"
  },
  {
   "model": "meteoswiss_icon_ch1",
   "run_init": "2026-10-24T09:00:00Z"
  },
  {
   "model": "meteoswiss_icon_ch2",
   "run_init": "2026-10-24T06:00:00Z"
  },
  {
   "model": "meteofrance_arome_france_hd",
   "run_init": "2026-10-24T06:00:00Z"
  },
  {
   "model": "ukmo_global_deterministic_10km",
   "run_init": "2026-10-24T00:00:00Z"
  },
  {
   "model": "gfs_global",
   "run_init": "2026-10-24T06:00:00Z"
  }
 ],
 "stale_after_min": 180,
 "expired_after_min": 1440,
 "hourly": {
  "time": [
   "2026-10-24T12:00:00Z",
   "2026-10-24T13:00:00Z",
   "2026-10-24T14:00:00Z",
   "2026-10-24T15:00:00Z",
   "2026-10-24T16:00:00Z",
   "2026-10-24T17:00:00Z",
   "2026-10-24T18:00:00Z",
   "2026-10-24T19:00:00Z",
   "2026-10-24T20:00:00Z",
   "2026-10-24T21:00:00Z",
   "2026-10-24T22:00:00Z",
   "2026-10-24T23:00:00Z",
   "2026-10-25T00:00:00Z",
   "2026-10-25T01:00:00Z",
   "2026-10-25T02:00:00Z",
   "2026-10-25T03:00:00Z",
   "2026-10-25T04:00:00Z",
   "2026-10-25T05:00:00Z",
   "2026-10-25T06:00:00Z",
   "2026-10-25T07:00:00Z",
   "2026-10-25T08:00:00Z",
   "2026-10-25T09:00:00Z",
   "2026-10-25T10:00:00Z",
   "2026-10-25T11:00:00Z",
   "2026-10-25T12:00:00Z",
   "2026-10-25T13:00:00Z",
   "2026-10-25T14:00:00Z",
   "2026-10-25T15:00:00Z",
   "2026-10-25T16:00:00Z",
   "2026-10-25T17:00:00Z",
   "2026-10-25T18:00:00Z",
   "2026-10-25T19:00:00Z",
   "2026-10-25T20:00:00Z",
   "2026-10-25T21:00:00Z",
   "2026-10-25T22:00:00Z",
   "2026-10-25T23:00:00Z",
   "2026-10-26T00:00:00Z",
   "2026-10-26T01:00:00Z",
   "2026-10-26T02:00:00Z",
   "2026-10-26T03:00:00Z",
   "2026-10-26T04:00:00Z",
   "2026-10-26T05:00:00Z",
   "2026-10-26T06:00:00Z",
   "2026-10-26T07:00:00Z",
   "2026-10-26T08:00:00Z",
   "2026-10-26T09:00:00Z",
   "2026-10-26T10:00:00Z",
   "2026-10-26T11:00:00Z",
   "2026-10-26T12:00:00Z"
  ],
  "temperature_c": {
   "corrected": true,
   "mean": [
    15.9,
    16,
    15.9,
    15.5,
    14.8,
    13.9,
    12.6,
    11.1,
    9.6,
    8.6,
    7.6,
    7.9,
    8.3,
    8.7,
    8.9,
    9,
    9.3,
    9.6,
    9,
    9.8,
    10.5,
    11.2,
    11.8,
    12.3,
    12.7,
    12.9,
    13,
    12.9,
    12.6,
    12.1,
    null,
    null,
    null,
    null,
    8.5,
    8,
    7.5,
    7.1,
    7,
    7.1,
    7.5,
    8,
    7,
    8.4,
    9.7,
    10.9,
    11.9,
    12.8,
    13.5
   ],
   "low": [
    15.4,
    15.4,
    15.3,
    14.8,
    14.1,
    13.1,
    11.5,
    10,
    8.3,
    7.2,
    6.4,
    6.9,
    7.4,
    7.9,
    8.1,
    8.1,
    8.5,
    8.6,
    8.1,
    8.6,
    9.4,
    9.9,
    10.5,
    11.2,
    11.5,
    11.6,
    11.7,
    11.7,
    11.1,
    10.9,
    null,
    null,
    null,
    null,
    7.2,
    6.6,
    5.7,
    5.7,
    5.6,
    5.4,
    5.8,
    6.2,
    5.1,
    6.7,
    8.1,
    9.1,
    10,
    11.1,
    11.4
   ],
   "high": [
    16.3,
    16.4,
    16.4,
    16,
    15.4,
    14.7,
    13.5,
    12.3,
    10.8,
    9.7,
    8.7,
    8.9,
    9.2,
    9.6,
    9.8,
    9.8,
    10.2,
    10.4,
    10,
    10.5,
    11.4,
    12,
    12.6,
    13.4,
    13.7,
    13.9,
    14.1,
    14.1,
    13.6,
    13.4,
    null,
    null,
    null,
    null,
    9.9,
    9.4,
    8.6,
    8.7,
    8.6,
    8.4,
    8.9,
    9.3,
    8.3,
    10,
    11.4,
    12.5,
    13.4,
    14.6,
    15
   ],
   "m_models": [
    10,
    10,
    10,
    10,
    10,
    10,
    10,
    10,
    10,
    10,
    10,
    10,
    10,
    10,
    10,
    10,
    10,
    10,
    10,
    10,
    10,
    10,
    10,
    10,
    10,
    10,
    10,
    10,
    10,
    10,
    0,
    0,
    0,
    0,
    9,
    9,
    9,
    9,
    9,
    9,
    9,
    9,
    9,
    8,
    8,
    8,
    8,
    8,
    8
   ],
   "lead_band": [
    0,
    0,
    0,
    0,
    0,
    0,
    0,
    0,
    0,
    0,
    0,
    0,
    1,
    1,
    1,
    1,
    1,
    1,
    1,
    1,
    1,
    1,
    1,
    1,
    1,
    1,
    1,
    1,
    1,
    1,
    1,
    1,
    1,
    1,
    1,
    1,
    2,
    2,
    2,
    2,
    2,
    2,
    2,
    2,
    2,
    2,
    2,
    2,
    2
   ]
  },
  "dew_point_c": {
   "corrected": false,
   "mean": [
    14.3,
    14.4,
    14.3,
    13.9,
    13.2,
    12.3,
    11,
    9.5,
    8,
    7,
    6,
    6.3,
    6.7,
    7.1,
    7.3,
    7.4,
    7.7,
    8,
    7.4,
    8.2,
    8.9,
    7.6,
    8.2,
    8.7,
    9.1,
    9.3,
    9.4,
    9.3,
    9,
    8.5,
    7.9,
    7.2,
    6.4,
    5.6,
    4.9,
    4.4,
    3.9,
    3.5,
    3.4,
    3.5,
    3.9,
    4.4,
    3.4,
    4.8,
    6.1,
    7.3,
    8.3,
    9.2,
    9.9
   ]
  },
  "wind_kmh": {
   "corrected": false,
   "mean": [
    11.2,
    11.7,
    13.9,
    14.1,
    15.4,
    16.3,
    15.5,
    16.4,
    16.9,
    17.9,
    18.8,
    19.8,
    20.8,
    20.9,
    13.8,
    14,
    13.2,
    12.3,
    12.1,
    12,
    11.6,
    11.3,
    9.5,
    9.1,
    7.2,
    8.8,
    7.2,
    7.4,
    7,
    6.6,
    7.7,
    7,
    6.3,
    6.8,
    6.7,
    6.1,
    6.5,
    5.7,
    6.3,
    6.6,
    5.2,
    5.7,
    5.1,
    5.5,
    4.8,
    5.8,
    5.5,
    6,
    5
   ]
  },
  "wind_dir_deg": {
   "corrected": false,
   "mean": [
    215,
    215,
    215,
    215,
    215,
    215,
    215,
    215,
    215,
    215,
    215,
    215,
    260,
    260,
    260,
    260,
    260,
    260,
    260,
    260,
    20,
    20,
    20,
    20,
    20,
    20,
    20,
    20,
    20,
    20,
    20,
    20,
    20,
    20,
    20,
    20,
    20,
    20,
    20,
    20,
    20,
    20,
    20,
    20,
    20,
    20,
    20,
    20,
    20
   ]
  },
  "gust_kmh": {
   "corrected": false,
   "mean": [
    22.9,
    24.4,
    26.4,
    29.1,
    32.2,
    32.1,
    30.6,
    32.1,
    34,
    35.5,
    38,
    39.2,
    40.7,
    42.3,
    22.7,
    22.4,
    22.7,
    20.3,
    21,
    20,
    19.4,
    18.4,
    18.1,
    16.1,
    14.4,
    14.4,
    14.1,
    13.6,
    11.9,
    12.1,
    13,
    13.5,
    11.9,
    12.9,
    13.6,
    11.7,
    13.1,
    9.5,
    10.5,
    12.8,
    8.4,
    10.3,
    8.4,
    10.7,
    9,
    11.6,
    10.8,
    11.8,
    9
   ]
  },
  "cloud_pct": {
   "corrected": false,
   "mean": [
    100,
    100,
    100,
    100,
    100,
    100,
    100,
    100,
    100,
    100,
    100,
    100,
    100,
    100,
    100,
    100,
    100,
    100,
    100,
    100,
    71,
    71,
    73,
    75,
    78,
    80,
    81,
    80,
    78,
    75,
    73,
    71,
    71,
    70,
    45,
    42,
    39,
    36,
    33,
    30,
    27,
    24,
    21,
    18,
    15,
    12,
    10,
    10,
    10
   ]
  },
  "precipitation_mm": {
   "corrected": false,
   "mean": [
    0,
    0,
    0.1,
    0.1,
    0.1,
    2.3,
    3,
    3.4,
    3.6,
    3.4,
    3,
    2.3,
    0.1,
    0.1,
    0.1,
    0,
    0,
    0,
    0,
    0,
    0,
    0,
    0,
    0.1,
    0.1,
    0.1,
    0.1,
    0.1,
    0.1,
    0.1,
    0,
    0,
    0,
    0,
    0,
    0,
    0,
    0,
    0,
    0,
    0,
    0,
    0,
    0,
    0,
    0,
    0,
    0,
    0
   ]
  },
  "rain": {
   "threshold_mm": 0.2,
   "n_models": [
    0,
    1,
    2,
    3,
    5,
    6,
    8,
    10,
    10,
    10,
    8,
    6,
    4,
    3,
    2,
    0,
    0,
    0,
    0,
    0,
    0,
    0,
    1,
    2,
    3,
    5,
    5,
    4,
    3,
    2,
    1,
    1,
    0,
    0,
    0,
    0,
    0,
    0,
    0,
    0,
    0,
    0,
    0,
    0,
    0,
    0,
    0,
    0,
    0
   ],
   "m_models": [
    10,
    10,
    10,
    10,
    10,
    10,
    10,
    10,
    10,
    10,
    10,
    10,
    10,
    10,
    10,
    10,
    10,
    10,
    10,
    10,
    10,
    10,
    10,
    10,
    10,
    10,
    10,
    10,
    10,
    10,
    10,
    10,
    10,
    10,
    9,
    9,
    9,
    9,
    9,
    9,
    9,
    9,
    9,
    8,
    8,
    8,
    8,
    8,
    8
   ]
  }
 },
 "daily": {
  "day": [
   "2026-10-25",
   "2026-10-26",
   "2026-10-27",
   "2026-10-28",
   "2026-10-29",
   "2026-10-30",
   "2026-10-31",
   "2026-11-01",
   "2026-11-02",
   "2026-11-03"
  ],
  "tmax_c": {
   "corrected": true,
   "mean": [
    13,
    14,
    15,
    16,
    14,
    13,
    14,
    13,
    12,
    12
   ],
   "low": [
    12.2,
    13.2,
    13.8,
    14.8,
    12.6,
    11.9,
    12.4,
    11.2,
    10.5,
    9.2
   ],
   "high": [
    13.4,
    14.7,
    15.7,
    17,
    15.1,
    14.8,
    15.6,
    15.6,
    15.2,
    14.3
   ],
   "m_models": [
    9,
    7,
    6,
    6,
    5,
    4,
    4,
    3,
    3,
    2
   ],
   "lead_band": [
    1,
    2,
    3,
    4,
    5,
    6,
    7,
    7,
    7,
    7
   ]
  },
  "tmin_c": {
   "corrected": true,
   "mean": [
    9,
    7,
    5,
    6,
    8,
    9,
    7,
    6,
    5,
    4
   ],
   "low": [
    8.6,
    6.3,
    4.3,
    5,
    6.9,
    7.2,
    5.4,
    3.4,
    1.8,
    1.7
   ],
   "high": [
    9.8,
    7.8,
    6.2,
    7.2,
    9.4,
    10.1,
    8.6,
    7.8,
    6.5,
    6.8
   ],
   "m_models": [
    9,
    7,
    6,
    6,
    5,
    4,
    4,
    3,
    3,
    2
   ],
   "lead_band": [
    1,
    2,
    3,
    4,
    5,
    6,
    7,
    7,
    7,
    7
   ]
  },
  "rain": {
   "threshold_mm": 1,
   "n_models": [
    6,
    1,
    0,
    1,
    2,
    1,
    0,
    1,
    0,
    0
   ],
   "m_models": [
    9,
    7,
    6,
    6,
    5,
    4,
    4,
    3,
    3,
    2
   ]
  }
 }
}
